name,ein,category,address,city,state,zip_code,website,description,phone
COLLEGE OF THE OZARKS,440556862,Education,100 OPPORTUNITY AVE,POINT LOOKOUT,MO,65726-0000,,"Education organization in POINT LOOKOUT, MO with annual revenue of approximately $115M",
CHIMES DISTRICT OF COLUMBIA INC,541691953,Human Services,4815 SETON DR,BALTIMORE,MD,21215-3211,,"Human Services organization in BALTIMORE, MD with annual revenue of approximately $115M",
CATALYST FAMILY INC,942376637,Education,350 WOODVIEW AVE STE 100,MORGAN HILL,CA,95037-8105,,"Education organization in MORGAN HILL, CA with annual revenue of approximately $115M",
THE CHICAGO SCHOOL - CALIFORNIA INC,900394713,Other,203 N LA SALLE ST STE 1900,CHICAGO,IL,60601-1263,,"Other organization in CHICAGO, IL with annual revenue of approximately $115M",
AIM SERVICES INC,141609398,Human Services,4227 ROUTE 50,SARATOGA SPGS,NY,12866-2927,,"Human Services organization in SARATOGA SPGS, NY with annual revenue of approximately $115M",
AMERICAN SOCIETY FOR TECHNION- ISRAEL INSTITUTE OF TECHNOLOGY INC,130434195,International,55 EAST 59TH STREET 14TH FLOOR,NEW YORK,NY,10022-1112,,"International organization in NEW YORK, NY with annual revenue of approximately $115M",
YOUTH ADVOCATE PROGRAMS INC,231977514,Human Services,3899 N FRONT ST,HARRISBURG,PA,17110-1535,,"Human Services organization in HARRISBURG, PA with annual revenue of approximately $115M",
REGIONAL FOOD BANK OF OKLAHOMA,731100380,Human Services,3355 S PURDUE ST,OKLAHOMA CITY,OK,73179-7640,,"Human Services organization in OKLAHOMA CITY, OK with annual revenue of approximately $115M",
ROCKHURST UNIVERSITY,440545813,Education,1100 ROCKHURST RD,KANSAS CITY,MO,64110-2508,,"Education organization in KANSAS CITY, MO with annual revenue of approximately $115M",
INDIANA UNIVERSITY HEALTH BALL MEMORIAL PHYSICIANS INC,351925641,Health,950 N MERIDIAN ST STE 1200,INDIANAPOLIS,IN,46204-1011,,"Health organization in INDIANAPOLIS, IN with annual revenue of approximately $115M",
KINGS DAUGHTERS MEDICAL CENTER,640333594,Health,PO BOX 948,BROOKHAVEN,MS,39602-0948,,"Health organization in BROOKHAVEN, MS with annual revenue of approximately $115M",
HARBOR HEALTH SERVICES INC,237100550,Health,1135 MORTON ST,MATTAPAN,MA,02126-2834,,"Health organization in MATTAPAN, MA with annual revenue of approximately $115M",
VOCATIONAL INSTRUCTION PROJECT COMMUNITY SERVICES INC,133224700,Other,770 E 176TH ST FL 6,BRONX,NY,10460-4617,,"Other organization in BRONX, NY with annual revenue of approximately $115M",
HUMAN CARE SERVICES FOR FAMILIES & CHILDREN INC,113338946,Health,1042 38TH ST,BROOKLYN,NY,11219-1011,,"Health organization in BROOKLYN, NY with annual revenue of approximately $115M",
UNIVERSITY OF TOLEDO PHYSICIANS CLINICAL FACILITY INC,201304472,Other,4510 DORR ST,TOLEDO,OH,43615-4040,,"Other organization in TOLEDO, OH with annual revenue of approximately $115M",
IOWA STUDENT LOAN LIQUIDITY CORP,421137531,Education,6805 VISTA DR,WDM,IA,50266-9307,,"Education organization in WDM, IA with annual revenue of approximately $115M",
ASIA FOUNDATION,941191246,International,465 CALIFORNIA STREET 7TH FLOOR,SAN FRANCISCO,CA,94104-1804,,"International organization in SAN FRANCISCO, CA with annual revenue of approximately $115M",
BREAKTHROUGH ENERGY FOUNDATION,853672460,Community,PO BOX 563,KIRKLAND,WA,98083-0563,,"Community organization in KIRKLAND, WA with annual revenue of approximately $115M",
MONARCH,561326126,Human Services,350 PEE DEE AVE STE A,ALBEMARLE,NC,28001-4932,,"Human Services organization in ALBEMARLE, NC with annual revenue of approximately $115M",
ROME MEMORIAL HOSPITAL INC,161471634,Health,1500 N JAMES ST,ROME,NY,13440-2844,,"Health organization in ROME, NY with annual revenue of approximately $115M",
UNIVERSITY OF MASSACHUSETTS GLOBAL,260152908,Education,65 ENTERPRISE STE 150,ALISO VIEJO,CA,92656-2707,,"Education organization in ALISO VIEJO, CA with annual revenue of approximately $114M",
BJU INC,571088101,Education,1700 WADE HAMPTON BLVD,GREENVILLE,SC,29614-1000,,"Education organization in GREENVILLE, SC with annual revenue of approximately $114M",
SISKIYOU HOSPITAL INC,941623075,Health,444 BRUCE ST,YREKA,CA,96097-3450,,"Health organization in YREKA, CA with annual revenue of approximately $114M",
LAKEVIEW CENTER INC,590737872,Health,1221 W LAKEVIEW AVE,PENSACOLA,FL,32501-1857,,"Health organization in PENSACOLA, FL with annual revenue of approximately $114M",
WILLIAM CAREY UNIVERSITY,640329300,Other,710 WILLIAM CAREY PARKWAY WCU BOX 1,HATTIESBURG,MS,39401-7842,,"Other organization in HATTIESBURG, MS with annual revenue of approximately $114M",
DISTRIBUTION COOPERATIVE INC,331113484,Community,1281 HIGHWAY 155 S,MC DONOUGH,GA,30253-7316,,"Community organization in MC DONOUGH, GA with annual revenue of approximately $114M",
EARLY LEARNING COALITION OF DUVAL INC,593688924,Education,6500 BOWDEN RD STE 290,JACKSONVILLE,FL,32216-8085,,"Education organization in JACKSONVILLE, FL with annual revenue of approximately $114M",
THRIVENT CHARITABLE IMPACT & INVESTING,411802412,Community,600 PORTLAND AVE STE 4100,MINNEAPOLIS,MN,55415-4402,,"Community organization in MINNEAPOLIS, MN with annual revenue of approximately $114M",
PRACTISING LAW INSTITUTE,135562321,Education,1177 AVENUE OF THE AMERICAS,NEW YORK,NY,10036-2714,,"Education organization in NEW YORK, NY with annual revenue of approximately $114M",
CARSON-TAHOE HEALTH SYSTEM,880502318,Health,1600 MEDICAL PKWY,CARSON CITY,NV,89703-4625,,"Health organization in CARSON CITY, NV with annual revenue of approximately $114M",
AUSTIN COMMUNITY FOUNDATION,741934031,Community,4315 GUADALUPE ST STE 300,AUSTIN,TX,78751-3644,,"Community organization in AUSTIN, TX with annual revenue of approximately $114M",
GREENWICH COUNTRY DAY SCHOOL INC,060646657,Education,OLD CHURCH RD BOX 623,GREENWICH,CT,06836-0000,,"Education organization in GREENWICH, CT with annual revenue of approximately $114M",
MOUNT DESERT ISLAND HOSPITAL,010211797,Health,10 WAYMAN LN,BAR HARBOR,ME,04609-1625,,"Health organization in BAR HARBOR, ME with annual revenue of approximately $114M",
GOODWIN HOUSE INCORPORATED,540623670,Human Services,4800 FILLMORE AVENUE,ALEXANDRIA,VA,22311-5070,,"Human Services organization in ALEXANDRIA, VA with annual revenue of approximately $114M",
EASTER SEALS NEW HAMPSHIRE INC,020272825,Human Services,555 AUBURN ST,MANCHESTER,NH,03103-4803,,"Human Services organization in MANCHESTER, NH with annual revenue of approximately $114M",
KNAPP MEDICAL CENTER,741393060,Health,PO BOX 1110,WESLACO,TX,78599-1110,,"Health organization in WESLACO, TX with annual revenue of approximately $114M",
ALICE HYDE MEDICAL CENTER,150346515,Health,133 PARK STREET,MALONE,NY,12953-1244,,"Health organization in MALONE, NY with annual revenue of approximately $114M",
AMERICAN COMMITTEE FOR THE WEIZMANN INSTITUTE OF SCIENCE INC,131623886,International,633 THIRD AVENUE 20TH FL,NEW YORK,NY,10017-8156,,"International organization in NEW YORK, NY with annual revenue of approximately $114M",
SAINT PAUL & MINNESOTA FOUNDATION,416031510,Community,101 5TH E ST STE 2400,SAINT PAUL,MN,55101-0000,,"Community organization in SAINT PAUL, MN with annual revenue of approximately $114M",
FIRST CATHOLIC SLOVAK UNION OF THE UNITED STATES & CANADA,340220550,Other,6611 ROCKSIDE RD 3RD FL,INDEPENDENCE,OH,44131-2365,,"Other organization in INDEPENDENCE, OH with annual revenue of approximately $114M",
GRAYS HARBOR COMMUNITY HOSPITAL,910568304,Other,915 ANDERSON DR,ABERDEEN,WA,98520-1006,,"Other organization in ABERDEEN, WA with annual revenue of approximately $114M",
PLANNED PARENTHOOD OF THE PACIFIC SOUTHWEST,956111785,Health,1075 CAMINO DEL RIO S,SAN DIEGO,CA,92108-3538,,"Health organization in SAN DIEGO, CA with annual revenue of approximately $114M",
COMMUNITY ACTION PARTNERSHIP OF SAN LUIS OBISPO COUNTY INC,952410253,Other,1030 SOUTHWOOD DR,SN LUIS OBISP,CA,93401-5813,,"Other organization in SN LUIS OBISP, CA with annual revenue of approximately $114M",
GATEWAY COMMUNITY CHARTERS,200231006,Education,PO BOX 269003,SACRAMENTO,CA,95826-9003,,"Education organization in SACRAMENTO, CA with annual revenue of approximately $114M",
PRIMARY HEALTH NETWORK,251381800,Health,63 PITT ST,SHARON,PA,16146-2102,,"Health organization in SHARON, PA with annual revenue of approximately $114M",
MCLAREN HEALTH MANAGEMENT GROUP,383491714,Health,1515 CAL DR,DAVISON,MI,48423-9016,,"Health organization in DAVISON, MI with annual revenue of approximately $114M",
BRIDGEPREP ACADEMY INC,270557724,Education,9875 SW 72ND ST,MIAMI,FL,33173-4617,,"Education organization in MIAMI, FL with annual revenue of approximately $114M",
LUCILE PACKARD FOUNDATION FOR CHILDRENS HEALTH,770440090,Health,400 HAMILTON AVE STE 340,PALO ALTO,CA,94301-1805,,"Health organization in PALO ALTO, CA with annual revenue of approximately $113M",
INDIANA UNIVERSITY HEALTH BEDFORD INC,237042323,Health,950 N MERIDIAN ST STE 1200,INDIANAPOLIS,IN,46204-1011,,"Health organization in INDIANAPOLIS, IN with annual revenue of approximately $113M",
ACH CHILD AND FAMILY SERVICES,750818140,Other,3712 WICHITA ST,FORT WORTH,TX,76119-2866,,"Other organization in FORT WORTH, TX with annual revenue of approximately $113M",
LIFEWORKS SERVICES INC,410907857,Human Services,6636 CEDAR AVE S,RICHFIELD,MN,55423-2705,,"Human Services organization in RICHFIELD, MN with annual revenue of approximately $113M",
AMERICAN COUNCILS FOR INTERNATIONAL EDUCATION ACTR ACCELS INC,521067256,International,1828 L ST NW STE 1200,WASHINGTON,DC,20036-5136,,"International organization in WASHINGTON, DC with annual revenue of approximately $113M",
PHILHARMONIC-SYMPHONY SOCIETY OF NEW YORK INC,131664054,Arts & Culture,10 LINCOLN CENTER PLAZA,NEW YORK,NY,10023-6912,,"Arts & Culture organization in NEW YORK, NY with annual revenue of approximately $113M",
SAMUEL MERRITT UNIVERSITY,942992642,Education,3100 TELEGRAPH AVE,OAKLAND,CA,94609-3239,,"Education organization in OAKLAND, CA with annual revenue of approximately $113M",
MARYWOOD UNIVERSITY,240795453,Education,2300 ADAMS AVE,SCRANTON,PA,18509-1514,,"Education organization in SCRANTON, PA with annual revenue of approximately $113M",
WASHINGTON UNIVERSITY PHYSICIANS IN ILLINOIS INC,822026363,Health,1414 CROSS STREET,O FALLON,IL,62269-2904,,"Health organization in O FALLON, IL with annual revenue of approximately $113M",
CONCORDIA UNIVERSITY,952798775,Education,1530 CONCORDIA,IRVINE,CA,92612-3203,,"Education organization in IRVINE, CA with annual revenue of approximately $113M",
ROSEMAN UNIVERSITY OF HEALTH SCIENCES A NEVADA NON-PROFIT CORP,880435559,Education,11 SUNSET WAY,HENDERSON,NV,89014-2333,,"Education organization in HENDERSON, NV with annual revenue of approximately $113M",
BIOTECHNOLOGY INNOVATION ORGANIZATION,521224577,Other,1201 NEW YORK AVE NW STE 1300,WASHINGTON,DC,20005-4853,,"Other organization in WASHINGTON, DC with annual revenue of approximately $113M",
ST ANTHONY REGIONAL HOSPITAL AND NURSING HOME,420733472,Health,311 S CLARK ST,CARROLL,IA,51401-3038,,"Health organization in CARROLL, IA with annual revenue of approximately $113M",
NEW VISTA COMMUNITIES INC,205452909,Health,1351 NEWTON PIKE,LEXINGTON,KY,40511-1275,,"Health organization in LEXINGTON, KY with annual revenue of approximately $113M",
A BEKA ACADEMY INC,593458436,Education,PO BOX 17600,PENSACOLA,FL,32522-7750,,"Education organization in PENSACOLA, FL with annual revenue of approximately $113M",
UNIVERSITY OF WYOMING FOUNDATION,830201971,Education,222 S 22ND ST,LARAMIE,WY,82070-5204,,"Education organization in LARAMIE, WY with annual revenue of approximately $113M",
ST ANTHONY HOSPITAL,930391614,Health,2801 ST ANTHONY WAY,PENDLETON,OR,97801-3800,,"Health organization in PENDLETON, OR with annual revenue of approximately $113M",
PCPT HAMLIN LLC,364903848,Health,2095 LAKESIDE CENTRE WAY STE 101,KNOXVILLE,TN,37922-6647,,"Health organization in KNOXVILLE, TN with annual revenue of approximately $113M",
SHANNON MEDICAL MANAGEMENT,208367966,Health,PO BOX 22000,SAN ANGELO,TX,76902-7200,,"Health organization in SAN ANGELO, TX with annual revenue of approximately $113M",
UNITED NATIONS FOUNDATION INC,582368165,International,1750 PENNSYLVANIA AVE NW STE 300,WASHINGTON,DC,20006-4515,,"International organization in WASHINGTON, DC with annual revenue of approximately $113M",
OPEN SKY COMMUNITY SERVICES INC,042587863,Human Services,4 MANN ST,WORCESTER,MA,01602-3414,,"Human Services organization in WORCESTER, MA with annual revenue of approximately $113M",
RANSOM EVERGLADES SCHOOL INC,590659070,Education,3575 MAIN HWY,COCONUT GROVE,FL,33133-5903,,"Education organization in COCONUT GROVE, FL with annual revenue of approximately $113M",
UNIVERSITY OF DALLAS,750926755,Education,1845 E NORTHGATE DR,IRVING,TX,75062-4736,,"Education organization in IRVING, TX with annual revenue of approximately $113M",
ASSOCIATION OF PUBLIC HEALTH LABORATORIES INC,521800436,Other,7700 WISCONSIN AVE STE 1000,BETHESDA,MD,20814-3587,,"Other organization in BETHESDA, MD with annual revenue of approximately $113M",
GRITMAN MEDICAL CENTER INC,820146328,Health,700 S MAIN ST,MOSCOW,ID,83843-3056,,"Health organization in MOSCOW, ID with annual revenue of approximately $113M",
ST MARYS HOSPITAL OF SUPERIOR,411811073,Other,3500 TOWER AVE,SUPERIOR,WI,54880-5335,,"Other organization in SUPERIOR, WI with annual revenue of approximately $113M",
UNIVERSITY OF EVANSVILLE,350868074,Education,1800 LINCOLN AVE,EVANSVILLE,IN,47722-1000,,"Education organization in EVANSVILLE, IN with annual revenue of approximately $113M",
MASSACHUSETTS HIGHER EDUCATION ASSISTANCE CORPORATION,042254705,Other,33 ARCH ST STE 2100,BOSTON,MA,02110-1442,,"Other organization in BOSTON, MA with annual revenue of approximately $113M",
HOAG HOSPITAL FOUNDATION,953222343,Health,330 PLACENTIA AVE,NEWPORT BEACH,CA,92663-3306,,"Health organization in NEWPORT BEACH, CA with annual revenue of approximately $112M",
MIAMI CANCER INSTITUTE AT BAPTIST HEALTH INC,473090066,Health,6855 RED ROAD STE 600,CORAL GABLES,FL,33143-3518,,"Health organization in CORAL GABLES, FL with annual revenue of approximately $112M",
HOTCHKISS SCHOOL,060647018,Education,11 INTERLAKEN RD,LAKEVILLE,CT,06039-2141,,"Education organization in LAKEVILLE, CT with annual revenue of approximately $112M",
SOCIEDAD ESPANOLA DE AUXILIO MUTUO Y BENEFICENCIA DE PUERTO RICO,660178704,Health,PO BOX 191227,SAN JUAN,PR,00919-1227,,"Health organization in SAN JUAN, PR with annual revenue of approximately $112M",
CONCORDIA UNIVERSITY ST PAUL,410696906,Other,1282 CONCORDIA AVE,SAINT PAUL,MN,55104-5479,,"Other organization in SAINT PAUL, MN with annual revenue of approximately $112M",
MYMICHIGAN MEDICAL CENTER CLARE,381518643,Other,703 N MCEWAN ST,CLARE,MI,48617-1440,,"Other organization in CLARE, MI with annual revenue of approximately $112M",
ONE BROOKLYN HEALTH SYSTEM INC,815323275,Health,1 BROOKDALE PLZ,BROOKLYN,NY,11212-3139,,"Health organization in BROOKLYN, NY with annual revenue of approximately $112M",
CORNELL SCOTT HILL HEALTH CORPORATION,060870990,Health,400 COLUMBUS AVE,NEW HAVEN,CT,06519-1233,,"Health organization in NEW HAVEN, CT with annual revenue of approximately $112M",
FENWAY COMMUNITY HEALTH CENTER INC,042510564,Health,1340 BOYLSTON ST,BOSTON,MA,02215-4302,,"Health organization in BOSTON, MA with annual revenue of approximately $112M",
UPLAND HILLS HEALTH INC,421017512,Health,800 COMPASSION WAY,DODGEVILLE,WI,53533-1956,,"Health organization in DODGEVILLE, WI with annual revenue of approximately $112M",
AGORA CYBER CHARTER SCHOOL,412170569,Education,1018 WEST 8TH AVENUE,KING OF PRUSSIA,PA,19406-1315,,"Education organization in KING OF PRUSSIA, PA with annual revenue of approximately $112M",
DEFENSEWERX INC,460684933,Research,1140 JOHN SIMS PKWY E,NICEVILLE,FL,32578-2204,,"Research organization in NICEVILLE, FL with annual revenue of approximately $112M",
COLLEGE OF ST SCHOLASTICA INC,410698301,Education,1200 KENWOOD AVE,DULUTH,MN,55811-4199,,"Education organization in DULUTH, MN with annual revenue of approximately $112M",
UPSTATE CEREBRAL PALSY INC,150543657,Health,125 BUSINESS PARK,UTICA,NY,13502-6305,,"Health organization in UTICA, NY with annual revenue of approximately $112M",
MICHIGAN HEALTH ENDOWMENT FUND,465054207,Health,9829 SPENCER RD STE 201,BRIGHTON,MI,48114-7718,,"Health organization in BRIGHTON, MI with annual revenue of approximately $112M",
ARCHCARE,133896624,Other,205 LEXINGTON AVENUE 3RD,NEW YORK,NY,10016-6053,,"Other organization in NEW YORK, NY with annual revenue of approximately $112M",
WASHINGTON AND JEFFERSON COLLEGE,250965601,Education,60 S LINCOLN ST,WASHINGTON,PA,15301-4812,,"Education organization in WASHINGTON, PA with annual revenue of approximately $112M",
WAYNE-METROPOLITAN COMMUNITY ACTION AGENCY,381976979,Community,7310 WOODWARD AVE STE 800,DETROIT,MI,48202-3196,,"Community organization in DETROIT, MI with annual revenue of approximately $112M",
YOUNG MENS CHRISTIAN ASSOCIATION OF METROPOLITAN LOS ANGELES,951644052,Human Services,4301 W 3RD ST,LOS ANGELES,CA,90020-3809,,"Human Services organization in LOS ANGELES, CA with annual revenue of approximately $112M",
NATIONAL CENTER FOR DEFENSE MANUFACTURING AND MACHINING,760727663,Research,699 SCALP AVE,JOHNSTOWN,PA,15904-1619,,"Research organization in JOHNSTOWN, PA with annual revenue of approximately $112M",
THUNDERMIST HEALTH CENTER,050355097,Health,171 SERVICE AVE FL 2,WARWICK,RI,02886-1015,,"Health organization in WARWICK, RI with annual revenue of approximately $112M",
CHRISTIAN COMMUNITY FOUNDATION OF MEMPHIS AND THE MID-SOUTH INC,621752885,Community,6075 POPLAR AVE STE 130,MEMPHIS,TN,38119-4702,,"Community organization in MEMPHIS, TN with annual revenue of approximately $112M",
INTERNATIONAL FOOD POLICY RESEARCH INSTITUTE,521041632,Human Services,1201 I STREET NW 12TH FLOOR,WASHINGTON,DC,20005-5905,,"Human Services organization in WASHINGTON, DC with annual revenue of approximately $112M",
GAUDENZIA INC,231706895,Health,106 W MAIN ST,NORRISTOWN,PA,19401-4716,,"Health organization in NORRISTOWN, PA with annual revenue of approximately $112M",
UNIVERSITY OF HAWAII FOUNDATION,990085260,Education,1810 UNIVERSITY AVE 300,HONOLULU,HI,96822-5416,,"Education organization in HONOLULU, HI with annual revenue of approximately $112M",
BLYTHEDALE CHILDRENS HOSPITAL,131739922,Health,BRADHURST AVE,VALHALLA,NY,10595-0000,,"Health organization in VALHALLA, NY with annual revenue of approximately $111M",
URBAN RESOURCE INSTITUTE,112561648,Human Services,75 BROAD ST RM 505,NEW YORK,NY,10004-3223,,"Human Services organization in NEW YORK, NY with annual revenue of approximately $111M",
HALO TRUST USA INC,522158152,International,1730 RHODE ISLAND AVE NW STE 206,WASHINGTON,DC,20036-3120,,"International organization in WASHINGTON, DC with annual revenue of approximately $111M",
TRUSTEES OF THE HAMLINE UNIVERSITY OF MINNESOTA,410693960,Education,1536 HEWITT AVE,SAINT PAUL,MN,55104-1205,,"Education organization in SAINT PAUL, MN with annual revenue of approximately $111M",
GOODWILL INDUSTRIES OF MIDDLE TENNESSEE INC,620599413,Human Services,937 HERMAN ST,NASHVILLE,TN,37208-3147,,"Human Services organization in NASHVILLE, TN with annual revenue of approximately $111M",
PRESBYTERIAN HOMES,471545753,Human Services,8707 SKOKIE BLVD STE 400,SKOKIE,IL,60077-2283,,"Human Services organization in SKOKIE, IL with annual revenue of approximately $111M",
PEAK VISTA COMMUNITY HEALTH CENTERS,840617567,Health,3205 N ACADEMY BLVD STE 130,COLORADO SPGS,CO,80917-5152,,"Health organization in COLORADO SPGS, CO with annual revenue of approximately $111M",
NONPROFITS INSURANCE ALLIANCE OF CALIFORNIA,770203935,Other,PO BOX 8507,SANTA CRUZ,CA,95061-8507,,"Other organization in SANTA CRUZ, CA with annual revenue of approximately $111M",
ROANOKE COLLEGE,540505945,Education,221 COLLEGE LN,SALEM,VA,24153-3794,,"Education organization in SALEM, VA with annual revenue of approximately $111M",
COMMUNITY HOUSING INNOVATIONS INC,133627750,Other,75 SOUTH BROADWAY 340,WHITE PLAINS,NY,10601-4413,,"Other organization in WHITE PLAINS, NY with annual revenue of approximately $111M",
REEDSBURG AREA MEDICAL CENTER INC,391091432,Health,2000 N DEWEY AVE,REEDSBURG,WI,53959-1049,,"Health organization in REEDSBURG, WI with annual revenue of approximately $111M",
INTERNATIONAL MEDICAL RELIEF,460494595,Health,500 E 8TH AVE,DENVER,CO,80203-3716,,"Health organization in DENVER, CO with annual revenue of approximately $111M",
WASHINGTON STATE UNIVERSITY FOUNDATION,911075542,Education,PO BOX 641927,PULLMAN,WA,99164-1927,,"Education organization in PULLMAN, WA with annual revenue of approximately $111M",
SOMERSET ACADEMY OF LAS VEGAS,275393412,Education,4650 LOSEE RD,N LAS VEGAS,NV,89081-4208,,"Education organization in N LAS VEGAS, NV with annual revenue of approximately $111M",
TERENCE CARDINAL COOKE HEALTH CARE CENTER,133007801,Health,205 LEXINGTON AVENUE 3RD,NEW YORK,NY,10016-6053,,"Health organization in NEW YORK, NY with annual revenue of approximately $111M",
ODA PRIMARY HEALTH CARE NETWORK INC,112329960,Other,74 WALLABOUT ST,BROOKLYN,NY,11249-7830,,"Other organization in BROOKLYN, NY with annual revenue of approximately $111M",
SALUD FAMILY HEALTH,840613540,Health,203 S ROLLIE AVE,FORT LUPTON,CO,80621-1508,,"Health organization in FORT LUPTON, CO with annual revenue of approximately $111M",
KIPP FOUNDATION,943362724,Education,1875 MISSION ST APT 130,SAN FRANCISCO,CA,94103-3561,,"Education organization in SAN FRANCISCO, CA with annual revenue of approximately $111M",
UNITED CHURCH HOMES INC,344429276,Human Services,170 E CENTER ST,MARION,OH,43302-3815,,"Human Services organization in MARION, OH with annual revenue of approximately $111M",
THE HELEN ROSS MCNABB CENTER,620548914,Health,200 TECH CENTER DR,KNOXVILLE,TN,37912-2747,,"Health organization in KNOXVILLE, TN with annual revenue of approximately $111M",
TIDEWELL HOSPICE INC,591911861,Human Services,6310 CAPITAL DRIVE,LAKEWOOD RANCH,FL,34202-5013,,"Human Services organization in LAKEWOOD RANCH, FL with annual revenue of approximately $111M",
THE SCHULMAN AND SCHACHNE INSTITUTE FOR NURSING AND REHABILITATION INC,237085986,Health,10101 AVENUE D,BROOKLYN,NY,11236-1902,,"Health organization in BROOKLYN, NY with annual revenue of approximately $111M",
PRINCIPIA CORPORATION,430652667,Education,13201 CLAYTON RD,SAINT LOUIS,MO,63131-1002,,"Education organization in SAINT LOUIS, MO with annual revenue of approximately $111M",
U B FOUNDATION ACTIVITIES INC,161372561,Other,PO BOX 900,BUFFALO,NY,14226-0900,,"Other organization in BUFFALO, NY with annual revenue of approximately $111M",
HASC CENTER INC,112630071,Human Services,5601 1ST AVE,BROOKLYN,NY,11220-2517,,"Human Services organization in BROOKLYN, NY with annual revenue of approximately $111M",
BAY AREA COMMUNITY SERVICES INC,941708069,Other,390 40TH ST,OAKLAND,CA,94609-2633,,"Other organization in OAKLAND, CA with annual revenue of approximately $111M",
PLANNED PARENTHOOD-ORANGE AND SAN BERNARDINO COUNTIES INC,956152773,Health,801 E KATELLA AVE,ANAHEIM,CA,92805-6614,,"Health organization in ANAHEIM, CA with annual revenue of approximately $111M",
SEQUOIA LIVING INC,941437728,Human Services,1525 POST ST,SAN FRANCISCO,CA,94109-6567,,"Human Services organization in SAN FRANCISCO, CA with annual revenue of approximately $111M",
WABASH COLLEGE,350868202,Education,301 W WABASH AVENUE,CRAWFORDSVILLE,IN,47933-2417,,"Education organization in CRAWFORDSVILLE, IN with annual revenue of approximately $111M",
LAWSCHOOL ADMISSIONS COUNCIL INC,132998164,Education,662 PENN ST,NEWTOWN,PA,18940-2176,,"Education organization in NEWTOWN, PA with annual revenue of approximately $110M",
WORLD LEARNING INC,030179592,International,PO BOX 676,BRATTLEBORO,VT,05302-0676,,"International organization in BRATTLEBORO, VT with annual revenue of approximately $110M",
TAKOMA REGIONAL HOSPITAL INC,510603966,Health,311 PRINCETON RD STE 1,JOHNSON CITY,TN,37601-2080,,"Health organization in JOHNSON CITY, TN with annual revenue of approximately $110M",
COMMUNITY FOUNDATION OF GREATER MEMPHIS INC,581723645,Community,1900 UNION AVE,MEMPHIS,TN,38104-4029,,"Community organization in MEMPHIS, TN with annual revenue of approximately $110M",
ALLIANCE DEFENDING FREEDOM,541660459,Religion,15100 N 90TH ST,SCOTTSDALE,AZ,85260-2769,,"Religion organization in SCOTTSDALE, AZ with annual revenue of approximately $110M",
GOODWILL INDUSTRIES OF SOUTHEASTERN WISCONSIN INC,390808491,Human Services,6055 N 91ST ST,MILWAUKEE,WI,53225-1710,,"Human Services organization in MILWAUKEE, WI with annual revenue of approximately $110M",
NEW YORK CLIMATE EXCHANGE INC,923384115,Environment,10 SOUTH STREET SLIP 7,NEW YORK,NY,10004-1921,,"Environment organization in NEW YORK, NY with annual revenue of approximately $110M",
MERCY HOSPITAL LEBANON,431767432,Health,100 HOSPITAL DR,LEBANON,MO,65536-9210,,"Health organization in LEBANON, MO with annual revenue of approximately $110M",
WINONA HEALTH SERVICES,410713914,Health,855 MANKATO AVE,WINONA,MN,55987-4868,,"Health organization in WINONA, MN with annual revenue of approximately $110M",
FRICK COLLECTION,131624012,Other,1 E 70TH ST,NEW YORK,NY,10021-4981,,"Other organization in NEW YORK, NY with annual revenue of approximately $110M",
COMMUNITY HOSPITAL OF BRAZOSPORT,741385192,Health,194 ABNER JACKSON PKWY,LAKE JACKSON,TX,77566-5160,,"Health organization in LAKE JACKSON, TX with annual revenue of approximately $110M",
SUTTER COAST HOSPITAL,942988520,Health,2200 RIVER PLAZA DR,SACRAMENTO,CA,95833-4134,,"Health organization in SACRAMENTO, CA with annual revenue of approximately $110M",
JACOBS & CUSHMAN SAN DIEGO FOOD BANK,204374795,Human Services,9850 DISTRIBUTION AVE,SAN DIEGO,CA,92121-2320,,"Human Services organization in SAN DIEGO, CA with annual revenue of approximately $110M",
