name,ein,category,address,city,state,zip_code,website,description,phone
HEALTHWISE INC,237455145,Health,2601 N BOGUS BASIN RD,BOISE,ID,83702-0909,,"Health organization in BOISE, ID with annual revenue of approximately $110M",
LINFIELD UNIVERSITY,930391586,Education,900 SE BAKER ST,MCMINNVILLE,OR,97128-6894,,"Education organization in MCMINNVILLE, OR with annual revenue of approximately $110M",
THE CONNECTICUT INSTITUTE FOR THE BLIND INC,060669111,Human Services,120 HOLCOMB ST,HARTFORD,CT,06112-1529,,"Human Services organization in HARTFORD, CT with annual revenue of approximately $110M",
CURRY COLLEGE,042199867,Education,1071 BLUE HILL AVE,MILTON,MA,02186-2302,,"Education organization in MILTON, MA with annual revenue of approximately $110M",
FIELD MUSEUM OF NATURAL HISTORY,362167011,Arts & Culture,1400 S DUSABLE LAKESHORE,CHICAGO,IL,60605-0000,,"Arts & Culture organization in CHICAGO, IL with annual revenue of approximately $110M",
NORTHEAST ARKANSAS CLINIC CHAR FOUNDATION INC,710850123,Community,4802 E JOHNSON AVE,JONESBORO,AR,72405-8413,,"Community organization in JONESBORO, AR with annual revenue of approximately $110M",
ELIZABETH GAMBLE DEACONESS HOME ASSOCIATION,311082756,Health,2139 AUBURN AVE,CINCINNATI,OH,45219-2906,,"Health organization in CINCINNATI, OH with annual revenue of approximately $110M",
NEW VISTA OF THE BLUEGRASS INC,610723605,Health,1351 NEWTOWN PIKE BLDG 1,LEXINGTON,KY,40511-1277,,"Health organization in LEXINGTON, KY with annual revenue of approximately $109M",
CHILDRENS MEDICAL CENTER FOUNDATION,752062015,Health,1935 MEDICAL DISTRICT DR,DALLAS,TX,75235-7701,,"Health organization in DALLAS, TX with annual revenue of approximately $109M",
CUMBERLAND FAMILY MEDICAL CENTER INC,203131989,Health,PO BOX 1080,BURKESVILLE,KY,42717-1080,,"Health organization in BURKESVILLE, KY with annual revenue of approximately $109M",
TURNING POINT FOR GOD,330095805,Religion,10007 RIVERFORD RD,LAKESIDE,CA,92040-2772,,"Religion organization in LAKESIDE, CA with annual revenue of approximately $109M",
COMMUNITY CARE COOPERATIVE INC,813005904,Health,75 FEDERAL ST,BOSTON,MA,02110-1913,,"Health organization in BOSTON, MA with annual revenue of approximately $109M",
EL CENTRO DEL BARRIO INC,741787031,Human Services,3750 COMMERCIAL AVE,SAN ANTONIO,TX,78221-3117,,"Human Services organization in SAN ANTONIO, TX with annual revenue of approximately $109M",
MOUNT SINAI COMMUNITY FOUNDATION,363305449,Other,CALIFORNIA AVENUE AT 15TH STREET,CHICAGO,IL,60609-0000,,"Other organization in CHICAGO, IL with annual revenue of approximately $109M",
SUTTER INSURANCE SERVICES CORPORATION,990289310,Other,700 BISHOP ST STE 1100,HONOLULU,HI,96813-4113,,"Other organization in HONOLULU, HI with annual revenue of approximately $109M",
GATEWAY FOUNDATION INC,362670036,Health,55 E JACKSON BLVD STE 1500,CHICAGO,IL,60604-4184,,"Health organization in CHICAGO, IL with annual revenue of approximately $109M",
BROWN MEDICINE,050450410,Health,110 ELM STREET 2ND FLOOR,PROVIDENCE,RI,02903-4626,,"Health organization in PROVIDENCE, RI with annual revenue of approximately $109M",
INSTITUTE OF NUCLEAR POWER OPERATIONS,581382198,Community,700 GALLERIA PKWY SE STE 100 STE 1,ATLANTA,GA,30339-5943,,"Community organization in ATLANTA, GA with annual revenue of approximately $109M",
SPRINGWELL INC,042616064,Human Services,307 WAVERLEY OAKS RD STE 205,WALTHAM,MA,02452-8413,,"Human Services organization in WALTHAM, MA with annual revenue of approximately $109M",
MOSES H CONE MEMORIAL HOSPITAL,560532302,Health,1200 N ELM ST,GREENSBORO,NC,27401-1004,,"Health organization in GREENSBORO, NC with annual revenue of approximately $109M",
CORE PHYSICIANS LLC,870807914,Health,CO BILH TAX 529 MAIN ST 4TH FL,CHARLESTOWN,MA,02129-0000,,"Health organization in CHARLESTOWN, MA with annual revenue of approximately $109M",
BAY AREA COMMUNITY RESOURCES,942346815,Health,11175 SAN PABLO AVE,EL CERRITO,CA,94530-2157,,"Health organization in EL CERRITO, CA with annual revenue of approximately $109M",
PARKER JEWISH INSTITUTE FOR HEALTH CARE AND REHABILITATION,132631069,Health,27111 76TH AVE,NEW HYDE PARK,NY,11040-1436,,"Health organization in NEW HYDE PARK, NY with annual revenue of approximately $109M",
ALVERNIA UNIVERSITY,231522643,Other,400 SAINT BERNARDINE ST,READING,PA,19607-1737,,"Other organization in READING, PA with annual revenue of approximately $109M",
CENTRAL FUND OF ISRAEL,132992985,International,461 CENTRAL AVE,CEDARHURST,NY,11516-2008,,"International organization in CEDARHURST, NY with annual revenue of approximately $109M",
BAYLOR ST LUKES MEDICAL GROUP,760458535,Health,6624 FANNIN ST,HOUSTON,TX,77030-2312,,"Health organization in HOUSTON, TX with annual revenue of approximately $109M",
"NORTH COUNTRY HOSPITAL & HEALTH CENTER,INC",030185556,Health,189 PROUTY DR,NEWPORT,VT,05855-9326,,"Health organization in NEWPORT, VT with annual revenue of approximately $109M",
ADVENTIST HEALTH DELANO,770258013,Health,1401 GARCES HWY,DELANO,CA,93215-3660,,"Health organization in DELANO, CA with annual revenue of approximately $109M",
WAYNESBORO HOSPITAL,231360854,Health,PO BOX 2767,YORK,PA,17405-2767,,"Health organization in YORK, PA with annual revenue of approximately $109M",
INTERNATIONAL CHILDRENS FUND INC,391303430,Other,619 MAIN ST,NEENAH,WI,54956-2430,,"Other organization in NEENAH, WI with annual revenue of approximately $109M",
COMMUNITY FDN OF GREATER DES MOINES,426139033,Community,1915 GRAND AVE,DES MOINES,IA,50309-3311,,"Community organization in DES MOINES, IA with annual revenue of approximately $109M",
FLORIDA STATE UNIVERSITY FOUNDATION INC,596152180,Education,325 W COLLEGE AVE,TALLAHASSEE,FL,32301-1403,,"Education organization in TALLAHASSEE, FL with annual revenue of approximately $109M",
NEW YORK BOTANICAL GARDEN,131693134,Environment,2900 SOUTHERN BLVD,BRONX,NY,10458-5126,,"Environment organization in BRONX, NY with annual revenue of approximately $109M",
BROOKINGS INSTITUTION,530196577,Research,1775 MASSACHUSETTS AVE NW,WASHINGTON,DC,20036-2103,,"Research organization in WASHINGTON, DC with annual revenue of approximately $109M",
CHILDRENS MEDICAL GROUP INC,391789197,Health,PO BOX 1997,MILWAUKEE,WI,53201-1997,,"Health organization in MILWAUKEE, WI with annual revenue of approximately $109M",
PHEAA STUDENT LOAN FOUNDATION INC,510423553,Community,1200 N 7TH ST,HARRISBURG,PA,17102-1419,,"Community organization in HARRISBURG, PA with annual revenue of approximately $108M",
KQED INC,941241309,Arts & Culture,2601 MARIPOSA ST,SAN FRANCISCO,CA,94110-1426,,"Arts & Culture organization in SAN FRANCISCO, CA with annual revenue of approximately $108M",
ASPIRE HEALTH PARTNERS INC,592301233,Health,5151 ADANSON STREET SUITE 200,ORLANDO,FL,32804-1317,,"Health organization in ORLANDO, FL with annual revenue of approximately $108M",
HUGGINS HOSPITAL,020223332,Health,PO BOX 912,WOLFEBORO,NH,03894-0912,,"Health organization in WOLFEBORO, NH with annual revenue of approximately $108M",
ADVANCE CARE ALLIANCE OF NY INC,465489816,Human Services,300 MOTOR PARKWAY,HAUPPAUGE,NY,11788-5191,,"Human Services organization in HAUPPAUGE, NY with annual revenue of approximately $108M",
PENOBSCOT COMMUNITY HEALTH CENTER,010514750,Health,103 MAINE AVE,BANGOR,ME,04401-4330,,"Health organization in BANGOR, ME with annual revenue of approximately $108M",
VISTA COMMUNITY CLINIC,952815615,Health,1000 VALE TERRACE DR,VISTA,CA,92084-5218,,"Health organization in VISTA, CA with annual revenue of approximately $108M",
DENVER FOUNDATION,846048381,Community,1009 N GRANT ST,DENVER,CO,80203-2908,,"Community organization in DENVER, CO with annual revenue of approximately $108M",
MINNESOTA PUBLIC RADIO,410953924,Arts & Culture,480 CEDAR ST,SAINT PAUL,MN,55101-2217,,"Arts & Culture organization in SAINT PAUL, MN with annual revenue of approximately $108M",
MAINE COMMUNITY FOUNDATION INC,010391479,Community,245 MAIN ST,ELLSWORTH,ME,04605-1613,,"Community organization in ELLSWORTH, ME with annual revenue of approximately $108M",
LIFEMOVES,770160469,Other,2550 GREAT AMERICA WAY STE 201,SANTA CLARA,CA,95054-1160,,"Other organization in SANTA CLARA, CA with annual revenue of approximately $108M",
MOUNT SINAI HEALTH SYSTEM SELF INSURANCE TRUST,823994798,Health,150 EAST 42ND STREET,NEW YORK,NY,10017-5612,,"Health organization in NEW YORK, NY with annual revenue of approximately $108M",
CIVIL AIR PATROL,756037853,Human Services,105 S HANSELL ST,MAXWELL AFB,AL,36112-5937,,"Human Services organization in MAXWELL AFB, AL with annual revenue of approximately $108M",
WARTBURG COLLEGE,420680351,Education,100 WARTBURG BLVD,WAVERLY,IA,50677-2215,,"Education organization in WAVERLY, IA with annual revenue of approximately $108M",
GENEVA GENERAL HOSPITAL,160743032,Health,196 NORTH ST,GENEVA,NY,14456-1651,,"Health organization in GENEVA, NY with annual revenue of approximately $108M",
PITZER COLLEGE,952261113,Education,1050 N MILLS AVE,CLAREMONT,CA,91711-3908,,"Education organization in CLAREMONT, CA with annual revenue of approximately $108M",
ACCESS SUPPORTS FOR LIVING INC,141471097,Human Services,15 FORTUNE RD W,MIDDLETOWN,NY,10941-1625,,"Human Services organization in MIDDLETOWN, NY with annual revenue of approximately $108M",
BUSINESS LEADERSHIP ORGANIZED FOR CATHOLIC SCHOOLS,232125843,Education,555 CROTON RD STE 120,KNG OF PRUSSA,PA,19406-3171,,"Education organization in KNG OF PRUSSA, PA with annual revenue of approximately $108M",
REDLANDS CHRISTIAN MIGRANT ASSOCIATION INC,591221966,Human Services,402 W MAIN ST,IMMOKALEE,FL,34142-3933,,"Human Services organization in IMMOKALEE, FL with annual revenue of approximately $108M",
CHILDRENS INSTITUTE INC,951641424,Human Services,2121 W TEMPLE ST,LOS ANGELES,CA,90026-4915,,"Human Services organization in LOS ANGELES, CA with annual revenue of approximately $108M",
UNIVERSITY OF LYNCHBURG,540505922,Education,1501 LAKESIDE DR,LYNCHBURG,VA,24501-3113,,"Education organization in LYNCHBURG, VA with annual revenue of approximately $108M",
SHORE HEALTH SERVICES INC,540560500,Health,608 DENBIGH BLVD STE 800,NEWPORT NEWS,VA,23608-4487,,"Health organization in NEWPORT NEWS, VA with annual revenue of approximately $108M",
OWENSBORO HEALTH MEDICAL GROUP INC,611197638,Health,1201 PLEASANT VALLEY RD,OWENSBORO,KY,42303-9811,,"Health organization in OWENSBORO, KY with annual revenue of approximately $108M",
IN-Q-TEL INC,522149962,International,1800 TYSONS BLVD STE 1200,MC LEAN,VA,22102-4261,,"International organization in MC LEAN, VA with annual revenue of approximately $108M",
UNITED PALESTINIAN APPEAL INC,112494808,International,1330 NEW HAMPSHIRE AVENUE NORTHWEST,WASHINGTON,DC,20036-6350,,"International organization in WASHINGTON, DC with annual revenue of approximately $108M",
CONCORDIA LUTHERAN MINISTRIES,205138278,Health,134 MARWOOD RD,CABOT,PA,16023-2206,,"Health organization in CABOT, PA with annual revenue of approximately $108M",
LESEA GLOBAL FEED THE HUNGRY INC,320053249,Community,61300 IRONWOOD RD,SOUTH BEND,IN,46614-9019,,"Community organization in SOUTH BEND, IN with annual revenue of approximately $108M",
ARC OF THE OZARKS,436049004,Other,1501 E PYTHIAN ST,SPRINGFIELD,MO,65802-2139,,"Other organization in SPRINGFIELD, MO with annual revenue of approximately $108M",
ST MARYS UNIVERSITY OF MINNESOTA,410695527,Education,700 TERRACE HTS,WINONA,MN,55987-1320,,"Education organization in WINONA, MN with annual revenue of approximately $107M",
ASCENSION VIA CHRISTI HOSPITAL MANHATTAN INC,481186704,Health,PO BOX 1289,MANHATTAN,KS,66505-1289,,"Health organization in MANHATTAN, KS with annual revenue of approximately $107M",
LIFESKILLS INC,610661819,Health,PO BOX 6499,BOWLING GREEN,KY,42102-6499,,"Health organization in BOWLING GREEN, KY with annual revenue of approximately $107M",
GOODWILL INDUSTRIES OF ORANGE COUNTY CA,951644018,Human Services,410 N FAIRVIEW ST,SANTA ANA,CA,92703-3412,,"Human Services organization in SANTA ANA, CA with annual revenue of approximately $107M",
THE LONG ISLAND HOME,112837244,Health,400 SUNRISE HIGHTWAY,AMITYVILLE,NY,11701-0000,,"Health organization in AMITYVILLE, NY with annual revenue of approximately $107M",
AMERICAN LUNG ASSOCIATION,131632524,Health,55 W WACKER DR STE 1150,CHICAGO,IL,60601-1796,,"Health organization in CHICAGO, IL with annual revenue of approximately $107M",
NEWTON HEALTHCARE CORPORATION,481040759,Health,600 MEDICAL CENTER DR,NEWTON,KS,67114-8780,,"Health organization in NEWTON, KS with annual revenue of approximately $107M",
BAY AREA COMMUNITY HEALTH,237255435,Other,40910 FREMONT BLVD,FREMONT,CA,94538-4375,,"Other organization in FREMONT, CA with annual revenue of approximately $107M",
NORTHWEST BEHAVIORAL HEALTH PARTNERSHIP INC,300177624,Health,2520 NEW BUTLER ROAD,NEW CASTLE,PA,16101-3213,,"Health organization in NEW CASTLE, PA with annual revenue of approximately $107M",
OAKS INTEGRATED CARE,237048397,Health,770 WOODLANE RD STE 23,WESTAMPTON,NJ,08060-3803,,"Health organization in WESTAMPTON, NJ with annual revenue of approximately $107M",
ST LUKES HOSPITAL AT THE VINTAGE,263734606,Health,6624 FANNIN ST STE 2505,HOUSTON,TX,77030-2338,,"Health organization in HOUSTON, TX with annual revenue of approximately $107M",
COPLEY HOSPITAL INC,030179423,Health,528 WASHINGTON HWY,MORRISVILLE,VT,05661-8973,,"Health organization in MORRISVILLE, VT with annual revenue of approximately $107M",
HOSPICE OF THE FLORIDA SUNCOAST INC,591744006,Human Services,6310 CAPITAL DRIVE,LAKEWOOD RANCH,FL,34202-5013,,"Human Services organization in LAKEWOOD RANCH, FL with annual revenue of approximately $107M",
MERCY LIFE CENTER CORPORATION,251604115,Health,1200 REEDSDALE ST,PITTSBURGH,PA,15233-2109,,"Health organization in PITTSBURGH, PA with annual revenue of approximately $107M",
COMMUNITY RESEARCH FOUNDATION INC,953248148,Other,1202 MORENA BLVD STE 100,SAN DIEGO,CA,92110-3842,,"Other organization in SAN DIEGO, CA with annual revenue of approximately $107M",
SERVICE ACCESS AND MANAGEMENT INC,232897133,Health,590 TERRY REILEY WAY,POTTSVILLE,PA,17901-1704,,"Health organization in POTTSVILLE, PA with annual revenue of approximately $107M",
AGRACE HOSPICECARE INCORPORATED,391319537,Other,5395 E CHERYL PKWY,FITCHBURG,WI,53711-5395,,"Other organization in FITCHBURG, WI with annual revenue of approximately $107M",
STOWERS INSTITUTE FOR MEDICAL RESEARCH,202993509,Health,1000 E 50TH ST,KANSAS CITY,MO,64110-2262,,"Health organization in KANSAS CITY, MO with annual revenue of approximately $107M",
GOODWILL INDUSTRIES OF GREATER NEW YORK AND NORTHERN NEW JERSEY INC,131641068,Human Services,25 ELM PLACE 3RD FLOOR,BROOKLYN,NY,11201-5826,,"Human Services organization in BROOKLYN, NY with annual revenue of approximately $107M",
ORGAN PROCUREMENT AGENCY OF MICHIGAN,382772488,Other,3861 RESEARCH PARK DR,ANN ARBOR,MI,48108-2217,,"Other organization in ANN ARBOR, MI with annual revenue of approximately $107M",
DAVIS MEMORIAL HOSPITAL,550375433,Health,PO BOX 1484,ELKINS,WV,26241-1484,,"Health organization in ELKINS, WV with annual revenue of approximately $107M",
MORSELIFE HOME CARE INC,592753822,Health,4847 DAVID S MACK DR,WEST PALM BCH,FL,33417-8023,,"Health organization in WEST PALM BCH, FL with annual revenue of approximately $107M",
DALTON SCHOOLS INC,132751872,Education,108 E 89TH ST,NEW YORK,NY,10128-1502,,"Education organization in NEW YORK, NY with annual revenue of approximately $107M",
CHARLESTOWN COMMUNITY INC,521315965,Health,701 MAIDEN CHOICE LN,CATONSVILLE,MD,21228-5968,,"Health organization in CATONSVILLE, MD with annual revenue of approximately $107M",
NORTHFIELD MOUNT HERMON SCHOOL,042109865,Education,ONE CAMPLIGHTER WAY,MOUNT HERMON,MA,01301-0000,,"Education organization in MOUNT HERMON, MA with annual revenue of approximately $107M",
METHODIST RETIREMENT COMMUNITIES,384022302,Other,1440 LAKE FRONT CIR STE 140,THE WOODLANDS,TX,77380-3607,,"Other organization in THE WOODLANDS, TX with annual revenue of approximately $107M",
HEALTH SERVICES MANAGEMENT INC,621808817,Health,206 FORTRESS BLVD,MURFREESBORO,TN,37128-5269,,"Health organization in MURFREESBORO, TN with annual revenue of approximately $107M",
STEP BY STEP INC,232053563,Human Services,744 KIDDER ST,WILKES BARRE,PA,18702-7015,,"Human Services organization in WILKES BARRE, PA with annual revenue of approximately $107M",
CALIFORNIA COLLEGE OF THE ARTS,941156485,Education,1111 8TH ST,SAN FRANCISCO,CA,94107-2247,,"Education organization in SAN FRANCISCO, CA with annual revenue of approximately $107M",
BAYLOR SCOTT & WHITE HOLDINGS,463130985,Health,301 N WASHINGTON AVE,DALLAS,TX,75246-1754,,"Health organization in DALLAS, TX with annual revenue of approximately $107M",
OKLAHOMA CITY COMMUNITY FOUNDATION INC,237024262,Community,1000 N BROADWAY AVE,OKLAHOMA CITY,OK,73102-5827,,"Community organization in OKLAHOMA CITY, OK with annual revenue of approximately $107M",
WEINGART CENTER ASSOCIATION,956054617,Human Services,566 S SAN PEDRO ST,LOS ANGELES,CA,90013-2102,,"Human Services organization in LOS ANGELES, CA with annual revenue of approximately $107M",
FAMILY HEALTH CENTERS OF SOUTHWEST FLORIDA INC,591741273,Health,PO BOX 1357,FORT MYERS,FL,33902-1357,,"Health organization in FORT MYERS, FL with annual revenue of approximately $106M",
AMERICAN SOCIETY FOR TESTING AND MATERIALS,231352024,Research,100 BARR HARBOR DR,CONSHOHOCKEN,PA,19428-2951,,"Research organization in CONSHOHOCKEN, PA with annual revenue of approximately $106M",
FLAGET HEALTHCARE INC,611345363,Other,4305 NEW SHEPHERDSVILLE RD,BARDSTOWN,KY,40004-9019,,"Other organization in BARDSTOWN, KY with annual revenue of approximately $106M",
SIOUX FALLS AREA COMMUNITY FOUNDATION INC,311748533,Community,200 CHERAPA PL,SIOUX FALLS,SD,57103-2205,,"Community organization in SIOUX FALLS, SD with annual revenue of approximately $106M",
NORDX,010511356,Health,301A US ROUTE 1,SCARBOROUGH,ME,04074-9701,,"Health organization in SCARBOROUGH, ME with annual revenue of approximately $106M",
GOODWILL INDUSTRIES OF NORTH CENTRAL WISC INC,391144913,Human Services,1800 APPLETON ROAD,MENASHA,WI,54952-3727,,"Human Services organization in MENASHA, WI with annual revenue of approximately $106M",
UCF ATHLETIC ASSOCIATION INC,562334448,Education,12201 RESEARCH PKWY STE 200,ORLANDO,FL,32826-3265,,"Education organization in ORLANDO, FL with annual revenue of approximately $106M",
CEDAR CREST VILLAGE LLC,522184915,Human Services,813 MAIDEN CHOICE LN,CATONSVILLE,MD,21228-3679,,"Human Services organization in CATONSVILLE, MD with annual revenue of approximately $106M",
ROBERT WOOD JOHNSON HEALTH NETWORK INC,223420314,Health,C/O CORP FINANCE 2 CRESCENT PLACE,OCEANPORT,NJ,07757-0000,,"Health organization in OCEANPORT, NJ with annual revenue of approximately $106M",
MAINE VETERANS HOME,010376832,Health,460 CIVIC CENTER DR,AUGUSTA,ME,04330-7902,,"Health organization in AUGUSTA, ME with annual revenue of approximately $106M",
DIDLAKE INC,540943833,Other,8641 BREEDEN AVENUE,MANASSAS,VA,20110-8431,,"Other organization in MANASSAS, VA with annual revenue of approximately $106M",
AMEGO INC,237131690,Health,33 PERRY AVE,ATTLEBORO,MA,02703-2417,,"Health organization in ATTLEBORO, MA with annual revenue of approximately $106M",
LEGAL SERVICES OF NEW JERSEY INC,222059939,Human Services,PO BOX 1357,EDISON,NJ,08818-1357,,"Human Services organization in EDISON, NJ with annual revenue of approximately $106M",
YOUNG MENS CHRISTIAN ASSOCIATION OF GREATER BOSTON INC,042103551,Human Services,316 HUNTINGTON AVENUE,BOSTON,MA,02115-5019,,"Human Services organization in BOSTON, MA with annual revenue of approximately $106M",
HOME-LIFE SERVICES INC,133899699,Human Services,440 89TH STREET 5TH FLOOR,BROOKLYN,NY,11209-6072,,"Human Services organization in BROOKLYN, NY with annual revenue of approximately $106M",
ROCKY MOUNTAIN HEALTH CARE SERVICES,840765729,Other,8595 EXPLORER DR,COLORADO SPGS,CO,80920-1012,,"Other organization in COLORADO SPGS, CO with annual revenue of approximately $106M",
HAMPDEN-SYDNEY COLLEGE,540505906,Education,PO BOX 127,HMPDEN SYDNEY,VA,23943-0127,,"Education organization in HMPDEN SYDNEY, VA with annual revenue of approximately $106M",
NATIVE AMERICAN HERITAGE ASSOCIATION,460414390,Human Services,12085 QUAAL RD,BLACK HAWK,SD,57718-9722,,"Human Services organization in BLACK HAWK, SD with annual revenue of approximately $106M",
ELIZABETHTOWN COLLEGE,231352632,Education,1 ALPHA DR,ELIZABETHTOWN,PA,17022-2298,,"Education organization in ELIZABETHTOWN, PA with annual revenue of approximately $106M",
QUEENS NORTH HAWAII COMMUNITY HOSPITAL,990260423,Health,67-1125 MAMALAHOA HWY,KAMUELA,HI,96743-8496,,"Health organization in KAMUELA, HI with annual revenue of approximately $106M",
METHODIST HEALTHCARE-OLIVE BRANCH HOSPITAL,640889822,Health,1211 UNION AVE SUITE 900,MEMPHIS,TN,38104-6638,,"Health organization in MEMPHIS, TN with annual revenue of approximately $106M",
VIRGINIA EARLY CHILDHOOD FOUNDATION,203970624,Education,1703 N PARHAM RD STE 110,RICHMOND,VA,23229-4650,,"Education organization in RICHMOND, VA with annual revenue of approximately $106M",
ST MARYS MEDICAL GROUP LLC,261356310,Health,PO BOX 45998,SAINT LOUIS,MO,63145-5998,,"Health organization in SAINT LOUIS, MO with annual revenue of approximately $106M",
KEYSTONE RURAL HEALTH CENTER,251546810,Health,111 CHAMBERS HILL DR STE 200,CHAMBERSBURG,PA,17201-7304,,"Health organization in CHAMBERSBURG, PA with annual revenue of approximately $106M",
ITHAKA HARBORS INC,133857105,Research,ONE LIBERTY PLAZA 165 BROADWAY 5TH,NEW YORK,NY,10006-1404,,"Research organization in NEW YORK, NY with annual revenue of approximately $106M",
PHILABUNDANCE,232290505,Human Services,3616 S GALLOWAY ST,PHILADELPHIA,PA,19148-5402,,"Human Services organization in PHILADELPHIA, PA with annual revenue of approximately $105M",
FEDCAP REHABILITATION SERVICES INC,135645879,Other,633 THIRD AVENUE 6TH FL,NEW YORK,NY,10017-6733,,"Other organization in NEW YORK, NY with annual revenue of approximately $105M",
FEED MORE INC,541150923,Human Services,8020 VILLA PARK DR,RICHMOND,VA,23228-6500,,"Human Services organization in RICHMOND, VA with annual revenue of approximately $105M",
HIGH TECH HIGH,330866664,Education,2861 WOMBLE RD,SAN DIEGO,CA,92106-6025,,"Education organization in SAN DIEGO, CA with annual revenue of approximately $105M",
MEMORIAL HERMANN HOSPITAL BASED PHYSICIAN GROUP,844504483,Health,929 GESSNER RD STE 1900,HOUSTON,TX,77024-2317,,"Health organization in HOUSTON, TX with annual revenue of approximately $105M",
AMERICAN BOARD OF INTERNAL MEDICINE,390866228,Health,510 WALNUT ST,PHILADELPHIA,PA,19106-3619,,"Health organization in PHILADELPHIA, PA with annual revenue of approximately $105M",
APLA HEALTH & WELLNESS,841661910,Health,611 S KINGSLEY DR,LOS ANGELES,CA,90005-2319,,"Health organization in LOS ANGELES, CA with annual revenue of approximately $105M",
COLLEGE OF ST BENEDICT BUSINESS OFF,410969244,Education,37 COLLEGE AVE S,SAINT JOSEPH,MN,56374-2001,,"Education organization in SAINT JOSEPH, MN with annual revenue of approximately $105M",
SERVICENET INC,042526194,Health,21 OLANDER DR,NORTHAMPTON,MA,01060-3631,,"Health organization in NORTHAMPTON, MA with annual revenue of approximately $105M",
ISLAND PEER REVIEW ORGANIZATION INC,112662689,Community,1979 MARCUS AVE,LAKE SUCCESS,NY,11042-1076,,"Community organization in LAKE SUCCESS, NY with annual revenue of approximately $105M",
GOODWILL INDUSTRIES OF THE VALLEY WORKS,270953369,Human Services,PO BOX 2420,ROANOKE,VA,24010-2420,,"Human Services organization in ROANOKE, VA with annual revenue of approximately $105M",
EASTER SEALS MIDWEST,430979927,Other,11933 WESTLINE IND DR,SAINT LOUIS,MO,63146-3203,,"Other organization in SAINT LOUIS, MO with annual revenue of approximately $105M",
BHMC-CONWAY,461629800,Health,9601 BAPTIST HEALTH DR,LITTLE ROCK,AR,72205-6316,,"Health organization in LITTLE ROCK, AR with annual revenue of approximately $105M",
CHILDRENS ANESTHESIOLOGY ASSOCIATES LTD,232592835,Health,3401 CIVIC CENTER BLVD SUITE 9302,PHILADELPHIA,PA,19104-4319,,"Health organization in PHILADELPHIA, PA with annual revenue of approximately $105M",
BROWARD BEHAVORIAL HEALTH COALITION INC,453675836,Health,1715 SE 4TH AVE,FT LAUDERDALE,FL,33316-2515,,"Health organization in FT LAUDERDALE, FL with annual revenue of approximately $105M",
TRINITY BROADCASTING OF TEXAS INC,741945661,Religion,2442 MICHELLE DR,TUSTIN,CA,92780-7015,,"Religion organization in TUSTIN, CA with annual revenue of approximately $105M",
BOSMA INDUSTRIES FOR THE BLIND INC,311246086,Human Services,6270 CORPORATE DR,INDIANAPOLIS,IN,46278-2900,,"Human Services organization in INDIANAPOLIS, IN with annual revenue of approximately $105M",
CITY OF OAKS FOUNDATION INC,274467111,Community,222 W HARGETT ST SUITE 608,RALEIGH,NC,27601-1316,,"Community organization in RALEIGH, NC with annual revenue of approximately $105M",
CHOATE ROSEMARY HALL FOUNDATION INCORPORATED,060910420,Education,333 CHRISTIAN ST,WALLINGFORD,CT,06492-3818,,"Education organization in WALLINGFORD, CT with annual revenue of approximately $105M",
CHAPTERS HEALTH SYSTEM INC,592264957,Human Services,12470 TELECOM DR STE 300,TEMPLE TERR,FL,33637-0904,,"Human Services organization in TEMPLE TERR, FL with annual revenue of approximately $105M",
PUBLIC INTEREST REGISTRY,331025119,Research,11911 FREEDOM DR STE 1000,RESTON,VA,20190-5631,,"Research organization in RESTON, VA with annual revenue of approximately $105M",
SAINT VINCENT COLLEGE,250964126,Education,300 FRASER PURCHASE RD,LATROBE,PA,15650-2667,,"Education organization in LATROBE, PA with annual revenue of approximately $105M",
SPORTS PHYSICALTHERAPY OCCUPATIONAL THERAPY AND REHABILITATION SERVICE,061655704,Health,972 BRUSH HOLLOW RD 5TH FL,WESTBURY,NY,11590-1740,,"Health organization in WESTBURY, NY with annual revenue of approximately $105M",
